{
  "schemaVersion": "1.0.0",
  "assessmentId": "fablecart-pickup-availability-2026-09",
  "fictional": true,
  "organization": "FableCart Retail (fictional)",
  "workflow": "Respond to false store-pickup availability reports",
  "assessmentDate": "2026-09-25",
  "evidence": [
    {
      "id": "agentrc-readiness",
      "sourceType": "agentrc_readiness",
      "title": "AgentRC repository-readiness result (microsoft/agentrc 2.1.0 (main at daa92160534031186327e3d8b25b11beeda7c021))",
      "location": "agentrc-readiness.json",
      "status": "observed",
      "content": "{\r\n  \u0022ok\u0022: true,\r\n  \u0022status\u0022: \u0022success\u0022,\r\n  \u0022data\u0022: {\r\n    \u0022repoPath\u0022: \u0022C:\\\\Repos\\\\Xebia\\\\GitHub AES Assessment\\\\fixtures\\\\fablecart\\\\repository\u0022,\r\n    \u0022generatedAt\u0022: \u00222026-09-25T09:56:45.595Z\u0022,\r\n    \u0022isMonorepo\u0022: false,\r\n    \u0022apps\u0022: [],\r\n    \u0022pillars\u0022: [\r\n      {\r\n        \u0022id\u0022: \u0022style-validation\u0022,\r\n        \u0022name\u0022: \u0022Style \u0026 Validation\u0022,\r\n        \u0022passed\u0022: 0,\r\n        \u0022total\u0022: 2,\r\n        \u0022passRate\u0022: 0\r\n      },\r\n      {\r\n        \u0022id\u0022: \u0022build-system\u0022,\r\n        \u0022name\u0022: \u0022Build System\u0022,\r\n        \u0022passed\u0022: 0,\r\n        \u0022total\u0022: 1,\r\n        \u0022passRate\u0022: 0\r\n      },\r\n      {\r\n        \u0022id\u0022: \u0022testing\u0022,\r\n        \u0022name\u0022: \u0022Testing\u0022,\r\n        \u0022passed\u0022: 0,\r\n        \u0022total\u0022: 0,\r\n        \u0022passRate\u0022: 0\r\n      },\r\n      {\r\n        \u0022id\u0022: \u0022documentation\u0022,\r\n        \u0022name\u0022: \u0022Documentation\u0022,\r\n        \u0022passed\u0022: 0,\r\n        \u0022total\u0022: 2,\r\n        \u0022passRate\u0022: 0\r\n      },\r\n      {\r\n        \u0022id\u0022: \u0022dev-environment\u0022,\r\n        \u0022name\u0022: \u0022Dev Environment\u0022,\r\n        \u0022passed\u0022: 0,\r\n        \u0022total\u0022: 2,\r\n        \u0022passRate\u0022: 0\r\n      },\r\n      {\r\n        \u0022id\u0022: \u0022code-quality\u0022,\r\n        \u0022name\u0022: \u0022Code Quality\u0022,\r\n        \u0022passed\u0022: 0,\r\n        \u0022total\u0022: 1,\r\n        \u0022passRate\u0022: 0\r\n      },\r\n      {\r\n        \u0022id\u0022: \u0022observability\u0022,\r\n        \u0022name\u0022: \u0022Observability\u0022,\r\n        \u0022passed\u0022: 0,\r\n        \u0022total\u0022: 1,\r\n        \u0022passRate\u0022: 0\r\n      },\r\n      {\r\n        \u0022id\u0022: \u0022security-governance\u0022,\r\n        \u0022name\u0022: \u0022Security \u0026 Governance\u0022,\r\n        \u0022passed\u0022: 0,\r\n        \u0022total\u0022: 4,\r\n        \u0022passRate\u0022: 0\r\n      },\r\n      {\r\n        \u0022id\u0022: \u0022ai-tooling\u0022,\r\n        \u0022name\u0022: \u0022AI Tooling\u0022,\r\n        \u0022passed\u0022: 0,\r\n        \u0022total\u0022: 5,\r\n        \u0022passRate\u0022: 0\r\n      }\r\n    ],\r\n    \u0022levels\u0022: [\r\n      {\r\n        \u0022level\u0022: 1,\r\n        \u0022name\u0022: \u0022Functional\u0022,\r\n        \u0022passed\u0022: 0,\r\n        \u0022total\u0022: 5,\r\n        \u0022passRate\u0022: 0,\r\n        \u0022achieved\u0022: false\r\n      },\r\n      {\r\n        \u0022level\u0022: 2,\r\n        \u0022name\u0022: \u0022Documented\u0022,\r\n        \u0022passed\u0022: 0,\r\n        \u0022total\u0022: 8,\r\n        \u0022passRate\u0022: 0,\r\n        \u0022achieved\u0022: false\r\n      },\r\n      {\r\n        \u0022level\u0022: 3,\r\n        \u0022name\u0022: \u0022Standardized\u0022,\r\n        \u0022passed\u0022: 0,\r\n        \u0022total\u0022: 5,\r\n        \u0022passRate\u0022: 0,\r\n        \u0022achieved\u0022: false\r\n      },\r\n      {\r\n        \u0022level\u0022: 4,\r\n        \u0022name\u0022: \u0022Optimized\u0022,\r\n        \u0022passed\u0022: 0,\r\n        \u0022total\u0022: 0,\r\n        \u0022passRate\u0022: 0,\r\n        \u0022achieved\u0022: false\r\n      },\r\n      {\r\n        \u0022level\u0022: 5,\r\n        \u0022name\u0022: \u0022Autonomous\u0022,\r\n        \u0022passed\u0022: 0,\r\n        \u0022total\u0022: 0,\r\n        \u0022passRate\u0022: 0,\r\n        \u0022achieved\u0022: false\r\n      }\r\n    ],\r\n    \u0022achievedLevel\u0022: 0,\r\n    \u0022criteria\u0022: [\r\n      {\r\n        \u0022id\u0022: \u0022lint-config\u0022,\r\n        \u0022title\u0022: \u0022Linting configured\u0022,\r\n        \u0022pillar\u0022: \u0022style-validation\u0022,\r\n        \u0022level\u0022: 1,\r\n        \u0022scope\u0022: \u0022repo\u0022,\r\n        \u0022impact\u0022: \u0022high\u0022,\r\n        \u0022effort\u0022: \u0022low\u0022,\r\n        \u0022status\u0022: \u0022fail\u0022,\r\n        \u0022reason\u0022: \u0022Missing ESLint/Biome/Prettier configuration.\u0022,\r\n        \u0022evidence\u0022: [\r\n          \u0022eslint.config.js\u0022,\r\n          \u0022.eslintrc\u0022,\r\n          \u0022biome.json\u0022,\r\n          \u0022.prettierrc\u0022\r\n        ]\r\n      },\r\n      {\r\n        \u0022id\u0022: \u0022typecheck-config\u0022,\r\n        \u0022title\u0022: \u0022Type checking configured\u0022,\r\n        \u0022pillar\u0022: \u0022style-validation\u0022,\r\n        \u0022level\u0022: 2,\r\n        \u0022scope\u0022: \u0022repo\u0022,\r\n        \u0022impact\u0022: \u0022medium\u0022,\r\n        \u0022effort\u0022: \u0022low\u0022,\r\n        \u0022status\u0022: \u0022fail\u0022,\r\n        \u0022reason\u0022: \u0022Missing type checking config (tsconfig or equivalent).\u0022,\r\n        \u0022evidence\u0022: [\r\n          \u0022tsconfig.json\u0022,\r\n          \u0022tsconfig.base.json\u0022,\r\n          \u0022pyproject.toml\u0022,\r\n          \u0022mypy.ini\u0022\r\n        ]\r\n      },\r\n      {\r\n        \u0022id\u0022: \u0022build-script\u0022,\r\n        \u0022title\u0022: \u0022Build script present\u0022,\r\n        \u0022pillar\u0022: \u0022build-system\u0022,\r\n        \u0022level\u0022: 1,\r\n        \u0022scope\u0022: \u0022app\u0022,\r\n        \u0022impact\u0022: \u0022high\u0022,\r\n        \u0022effort\u0022: \u0022low\u0022,\r\n        \u0022status\u0022: \u0022skip\u0022,\r\n        \u0022reason\u0022: \u0022No application packages detected.\u0022\r\n      },\r\n      {\r\n        \u0022id\u0022: \u0022ci-config\u0022,\r\n        \u0022title\u0022: \u0022CI workflow configured\u0022,\r\n        \u0022pillar\u0022: \u0022build-system\u0022,\r\n        \u0022level\u0022: 2,\r\n        \u0022scope\u0022: \u0022repo\u0022,\r\n        \u0022impact\u0022: \u0022high\u0022,\r\n        \u0022effort\u0022: \u0022medium\u0022,\r\n        \u0022status\u0022: \u0022fail\u0022,\r\n        \u0022reason\u0022: \u0022Missing .github/workflows CI configuration.\u0022,\r\n        \u0022evidence\u0022: [\r\n          \u0022.github/workflows\u0022\r\n        ]\r\n      },\r\n      {\r\n        \u0022id\u0022: \u0022test-script\u0022,\r\n        \u0022title\u0022: \u0022Test script present\u0022,\r\n        \u0022pillar\u0022: \u0022testing\u0022,\r\n        \u0022level\u0022: 1,\r\n        \u0022scope\u0022: \u0022app\u0022,\r\n        \u0022impact\u0022: \u0022high\u0022,\r\n        \u0022effort\u0022: \u0022low\u0022,\r\n        \u0022status\u0022: \u0022skip\u0022,\r\n        \u0022reason\u0022: \u0022No application packages detected.\u0022\r\n      },\r\n      {\r\n        \u0022id\u0022: \u0022readme\u0022,\r\n        \u0022title\u0022: \u0022README present\u0022,\r\n        \u0022pillar\u0022: \u0022documentation\u0022,\r\n        \u0022level\u0022: 1,\r\n        \u0022scope\u0022: \u0022repo\u0022,\r\n        \u0022impact\u0022: \u0022high\u0022,\r\n        \u0022effort\u0022: \u0022low\u0022,\r\n        \u0022status\u0022: \u0022fail\u0022,\r\n        \u0022reason\u0022: \u0022Missing README documentation.\u0022,\r\n        \u0022evidence\u0022: [\r\n          \u0022README.md\u0022\r\n        ]\r\n      },\r\n      {\r\n        \u0022id\u0022: \u0022contributing\u0022,\r\n        \u0022title\u0022: \u0022CONTRIBUTING guide present\u0022,\r\n        \u0022pillar\u0022: \u0022documentation\u0022,\r\n        \u0022level\u0022: 2,\r\n        \u0022scope\u0022: \u0022repo\u0022,\r\n        \u0022impact\u0022: \u0022medium\u0022,\r\n        \u0022effort\u0022: \u0022low\u0022,\r\n        \u0022status\u0022: \u0022fail\u0022,\r\n        \u0022reason\u0022: \u0022Missing CONTRIBUTING.md for contributor workflows.\u0022\r\n      },\r\n      {\r\n        \u0022id\u0022: \u0022lockfile\u0022,\r\n        \u0022title\u0022: \u0022Lockfile present\u0022,\r\n        \u0022pillar\u0022: \u0022dev-environment\u0022,\r\n        \u0022level\u0022: 1,\r\n        \u0022scope\u0022: \u0022repo\u0022,\r\n        \u0022impact\u0022: \u0022high\u0022,\r\n        \u0022effort\u0022: \u0022low\u0022,\r\n        \u0022status\u0022: \u0022fail\u0022,\r\n        \u0022reason\u0022: \u0022Missing package manager lockfile.\u0022\r\n      },\r\n      {\r\n        \u0022id\u0022: \u0022env-example\u0022,\r\n        \u0022title\u0022: \u0022Environment example present\u0022,\r\n        \u0022pillar\u0022: \u0022dev-environment\u0022,\r\n        \u0022level\u0022: 2,\r\n        \u0022scope\u0022: \u0022repo\u0022,\r\n        \u0022impact\u0022: \u0022medium\u0022,\r\n        \u0022effort\u0022: \u0022low\u0022,\r\n        \u0022status\u0022: \u0022fail\u0022,\r\n        \u0022reason\u0022: \u0022Missing .env.example or .env.sample for setup guidance.\u0022\r\n      },\r\n      {\r\n        \u0022id\u0022: \u0022format-config\u0022,\r\n        \u0022title\u0022: \u0022Formatter configured\u0022,\r\n        \u0022pillar\u0022: \u0022code-quality\u0022,\r\n        \u0022level\u0022: 2,\r\n        \u0022scope\u0022: \u0022repo\u0022,\r\n        \u0022impact\u0022: \u0022medium\u0022,\r\n        \u0022effort\